{
  "schemaVersion": "0.1",
  "generatedAt": "2026-06-16T17:23:58.281Z",
  "projectId": "atomic-skills",
  "plan": {
    "slug": "skills-restructuring",
    "title": "Reestruturação das skills atomic-skills",
    "status": "active"
  },
  "phase": {
    "id": "F2",
    "slug": "skills-restructuring-f2-economia-de-tokens-padroes-transversais",
    "title": "Economia de tokens: padrões transversais",
    "index": 3,
    "total": 7,
    "status": "active"
  },
  "tasks": {
    "done": 0,
    "total": 7,
    "blocked": 0
  },
  "gates": {
    "met": 0,
    "total": 1
  },
  "nextAction": "Start T2.1: Convenção Red Flags e Rationalization em todas as skills",
  "flags": {
    "drift": false,
    "multipleActivePlans": false
  },
  "sources": [
    {
      "path": ".atomic-skills/projects/atomic-skills/skills-restructuring/plan.md",
      "lastUpdated": "2026-06-16T16:50:35Z"
    },
    {
      "path": ".atomic-skills/projects/atomic-skills/skills-restructuring/phases/f2-economia-de-tokens-padroes-transversais.md",
      "lastUpdated": "2026-06-16T16:50:35Z"
    }
  ]
}
